{
  "event_id": "01JQ3AA05JRZ0CN5Z2S9KYX613",
  "emitter_id": "01JQ3A7XW5K9J2N8M4P6R0T3V1",
  "emitter_version": 4,
  "occurred_at": "2026-07-12T10:15:28.200Z",
  "kind": "prompt_link.upsert",
  "trace_id": "tr_123",
  "entity_id": "link_tr_123_obs_llm_1_support",
  "data": {
    "prompt": {
      "name": "acme.prompt.support",
      "version": 3,
      "label": "production"
    },
    "observation_id": "obs_llm_1"
  }
}
